### ISSUE TITLE
Issues receiving audio from Websocket

### ISSUE THREAD

**Issue by t-dettling** [amigniter/mod_audio_stream#4]
Hello,
I have been trying to get mod_audio_stream working to send the audio stream from a call to a python script (or maybe even this https://github.com/novnc/websockify, the goal really is that I need a stream of audio from calls, so that I can use it in my application) and I seem to be running into some issues. Using TCPDump I was able to verify that there is audio coming in from the call to freeswitch, but then I do not see any data coming over the websocket. Is there any specific messages that I need to send over the websocket to start the audio data sending? Here is a tiny tornado program that I am thinking should print the data from the websocket to the console:
```
#!/usr/bin/python

import tornado.web
import tornado.websocket
import tornado.ioloop

class WebSocketHandler(tornado.websocket.WebSocketHandler):
    def open(self):
        print("New client connected")
        self.write_message("You are connected")

    def on_message(self, message):
        #self.write_message(message)
        print(message)

    def on_close(self):
        print("Client disconnected")

application = tornado.web.Application([(r"/", WebSocketHandler),])

if __name__ == "__main__":
    application.listen(8888)
    tornado.ioloop.IOLoop.instance().start()
```

The process that I am currently doing is, call freeswitch, have a dialplan that plays infinite silence, and then run `show calls` in `fs_cli` then from there I use the uuid from the call to start the stream to the websocket, here is the output of the logs after I start the websocket:
```
freeswitch@freeswitch> uuid_audio_stream <CALL_UUID> start ws://localhost:8888 mono 8k
+OK Success

2023-08-16 17:04:12.126495 99.33% [DEBUG] mod_audio_stream.c:144 mod_audio_stream cmd: <CALL_UUID> start ws://localhost:8888 mono 8k
2023-08-16 17:04:12.126495 99.33% [DEBUG] mod_audio_stream.c:75 calling stream_session_init.
2023-08-16 17:04:12.126495 99.33% [DEBUG] audio_streamer_glue.cpp:260 (<CALL_UUID>) no resampling needed for this call
2023-08-16 17:04:12.126495 99.33% [DEBUG] audio_streamer_glue.cpp:263 (<CALL_UUID>) stream_data_init
2023-08-16 17:04:12.126495 99.33% [DEBUG] mod_audio_stream.c:81 adding bug.
2023-08-16 17:04:12.126495 99.33% [DEBUG] switch_core_media_bug.c:976 Attaching BUG to sofia/external/~~~0~@<CALLER_IP>
2023-08-16 17:04:12.126495 99.33% [DEBUG] mod_audio_stream.c:85 setting bug private data.
2023-08-16 17:04:12.126495 99.33% [DEBUG] mod_audio_stream.c:88 exiting start_capture.
2023-08-16 17:04:12.126495 99.33% [INFO] audio_streamer_glue.cpp:129 response: You are connected
2023-08-16 17:04:12.186530 99.33% [DEBUG] switch_core_io.c:448 Setting BUG Codec PCMU:0
```

After a long period of time there is no errors or disconnects in the log and my python code prints "New client connected" as expected, but then no data is ever printed to the console. Is there something super obvious that I am missing here?

**Comment by placs-tdettling** [comment]
Okay so I have done more testing now, I am pretty sure there is something I am missing or that the module is not working as expected. I have installed websockify, and I have it listening on 127.0.0.1 port 8888 and it sends it to 127.0.0.1 port 9999 which is a listening netcat socket. From this I can type messages in nc which show up in the logs of freeswitch, and tcpdump shows the packets going between the two ports, but at no point do I see anything that looks like audio packets.

Here is what I send in netcat:
```
root@freeswitch:~# nc -nvlp 9999
listening on [any] 9999 ...
connect to [127.0.0.1] from (UNKNOWN) [127.0.0.1] 45240
this message should show up in the freeswitch logs
messages are sent, and they show up on both ends of the tcpdump, and do show in the freeswitch logs
which means they are making it from the socket to the websocket and back, but at no point does any audio data begin to send, which seems odd to me
i would expect netcat to print a bunch of gargage to the console as audio data is sent from the call to the websocket and then to netcat
```

Then here is what my websockify thread looks like:
```
root@freeswitch:~# python3 -m websockify 127.0.0.1:8888 127.0.0.1:9999
WebSocket server settings:
  Listen on 127.0.0.1:8888
  No SSL/TLS support (no cert file)
- proxying from 127.0.0.1:8888 to 127.0.0.1:9999
127.0.0.1 - - [16/Aug/2023 18:22:54] 127.0.0.1: Plain non-SSL (ws://) WebSocket connection
127.0.0.1 - - [16/Aug/2023 18:22:54] connecting to: 127.0.0.1:9999
```

TCPDump (truncated but for everything its the same messages back and forth):
```
18:24:23.241297 IP localhost.8888 > localhost.33290: Flags [P.], seq 355:506, ack 273, win 512, options [nop,nop,TS val 2108773134 ecr 2108740053], length 151
        0x0000:  0000 0000 0000 0000 0000 0000 0800 4500  ..............E.
        0x0010:  00cb 4129 4000 4006 fb01 7f00 0001 7f00  ..A)@.@.........
        0x0020:  0001 22b8 820a c6d8 ccca 2f7c 3fbb 8018  .."......./|?...
        0x0030:  0200 febf 0000 0101 080a 7db1 530e 7db0  ..........}.S.}.
0x0040:  d1d5 827e 0093 7768 6963 6820 6d65 616e  ...~..which.mean
0x0050:  7320 7468 6579 2061 7265 206d 616b 696e  s.they.are.makin
0x0060:  6720 6974 2066 726f 6d20 7468 6520 736f  g.it.from.the.so
0x0070:  636b 6574 2074 6f20 7468 6520 7765 6273  cket.to.the.webs
0x0080:  6f63 6b65 7420 616e 6420 6261 636b 2c20  ocket.and.back,.
0x0090:  6275 7420 6174 206e 6f20 706f 696e 7420  but.at.no.point.
0x00a0:  646f 6573 2061 6e79 2061 7564 696f 2064  does.any.audio.d
0x00b0:  6174 6120 6265 6769 6e20 746f 2073 656e  ata.begin.to.sen
0x00c0:  642c 2077 6869 6368 2073 6565 6d73 206f  d,.which.seems.o
0x00d0:  6464 2074 6f20 6d65 0a                   dd.to.me.
18:24:23.241303 IP localhost.33290 > localhost.8888: Flags [.], ack 506, win 510, options [nop,nop,TS val 2108773135 ecr 2108773134], length 0
        0x0000:  0000 0000 0000 0000 0000 0000 0800 4500  ..............E.
0x0010:  0034 08b5 4000 4006 340d 7f00 0001 7f00  .4..@.@.4.......
0x0020:  0001 820a 22b8 2f7c 3fbb c6d8 cd61 8010  ...."./|?....a..
0x0030:  01fe fe28 0000 0101 080a 7db1 530f 7db1  ...(......}.S.}.
0x0040:  530e                                     S.
18:24:58.089064 IP localhost.9999 > localhost.45240: Flags [P.], seq 299:436, ack 1, win 512, options [nop,nop,TS val 2108807982 ecr 2108773134], length 137
        0x0000:  0000 0000 0000 0000 0000 0000 0800 4500  ..............E.
0x0010:  00bd 75a8 4000 4006 c690 7f00 0001 7f00  ..u.@.@.........
0x0020:  0001 270f b0b8 4a86 610c 1b4a cf79 8018  ..'...J.a..J.y..
0x0030:  0200 feb1 0000 0101 080a 7db1 db2e 7db1  ..........}...}.
0x0040:  530e 6920 776f 756c 6420 6578 7065 6374  S.i.would.expect
0x0050:  206e 6574 6361 7420 746f 2070 7269 6e74  .netcat.to.print
0x0060:  2061 2062 756e 6368 206f 6620 6761 7267  .a.bunch.of.garg
0x0070:  6167 6520 746f 2074 6865 2063 6f6e 736f  age.to.the.conso
0x0080:  6c65 2061 7320 6175 6469 6f20 6461 7461  le.as.audio.data
0x0090:  2069 7320 7365 6e74 2066 726f 6d20 7468  .is.sent.from.th
0x00a0:  6520 6361 6c6c 2074 6f20 7468 6520 7765  e.call.to.the.we
0x00b0:  6273 6f63 6b65 7420 616e 6420 7468 656e  bsocket.and.then
0x00c0:  2074 6f20 6e65 7463 6174 0a              .to.netcat.
18:24:58.089075 IP localhost.45240 > localhost.9999: Flags [.], ack 436, win 510, options [nop,nop,TS val 2108807982 ecr 2108807982], length 0
        0x0000:  0000 0000 0000 0000 0000 0000 0800 4500  ..............E.
0x0010:  0034 2916 4000 4006 13ac 7f00 0001 7f00  .4).@.@.........
0x0020:  0001 b0b8 270f 1b4a cf79 4a86 6195 8010  ....'..J.yJ.a...
0x0030:  01fe fe28 0000 0101 080a 7db1 db2e 7db1  ...(......}...}.
0x0040:  db2e                                     ..
18:24:58.089190 IP localhost.8888 > localhost.33290: Flags [P.], seq 506:647, ack 273, win 512, options [nop,nop,TS val 2108807982 ecr 2108773135], length 141
        0x0000:  0000 0000 0000 0000 0000 0000 0800 4500  ..............E.
0x0010:  00c1 412a 4000 4006 fb0a 7f00 0001 7f00  ..A*@.@.........
0x0020:  0001 22b8 820a c6d8 cd61 2f7c 3fbb 8018  .."......a/|?...
0x0030:  0200 feb5 0000 0101 080a 7db1 db2e 7db1  ..........}...}.
0x0040:  530f 827e 0089 6920 776f 756c 6420 6578  S..~..i.would.ex
0x0050:  7065 6374 206e 6574 6361 7420 746f 2070  pect.netcat.to.p
0x0060:  7269 6e74 2061 2062 756e 6368 206f 6620  rint.a.bunch.of.
0x0070:  6761 7267 6167 6520 746f 2074 6865 2063  gargage.to.the.c
0x0080:  6f6e 736f 6c65 2061 7320 6175 6469 6f20  onsole.as.audio.
0x0090:  6461 7461 2069 7320 7365 6e74 2066 726f  data.is.sent.fro
0x00a0:  6d20 7468 6520 6361 6c6c 2074 6f20 7468  m.the.call.to.th
0x00b0:  6520 7765 6273 6f63 6b65 7420 616e 6420  e.websocket.and.
0x00c0:  7468 656e 2074 6f20 6e65 7463 6174 0a    then.to.netcat.
18:24:58.089195 IP localhost.33290 > localhost.8888: Flags [.], ack 647, win 509, options [nop,nop,TS val 2108807982 ecr 2108807982], length 0
        0x0000:  0000 0000 0000 0000 0000 0000 0800 4500  ..............E.
0x0010:  0034 08b6 4000 4006 340c 7f00 0001 7f00  .4..@.@.4.......
0x0020:  0001 820a 22b8 2f7c 3fbb c6d8 cdee 8010  ...."./|?.......
0x0030:  01fd fe28 0000 0101 080a 7db1 db2e 7db1  ...(......}...}.
0x0040:  db2e                                     ..
```

Freeswitch CLI:
```
freeswitch@freeswitch> sofia global siptrace on
+OK Global siptrace on
recv 877 bytes from udp/[<IP_REDACTED>]:5060 at 18:22:23.344381:
------------------------------------------------------------------------
INVITE sip:<PHONE_NUMBER_REDACTED>@<IP_REDACTED> SIP/2.0
Date: Wed, 16 Aug 2023 18:22:23 GMT
CSeq: 1 INVITE
Via: SIP/2.0/UDP <IP_REDACTED>:5060;branch=z9hG4bK8bbb.4f76a707.0
P-Gb-Info: 1
User-Agent: Gridborg Server 1.5.0
From: <sip:%7E%7E%7E0%7E@<IP_REDACTED>>;tag=c6a27883-cf3a-ee11-94af-da5682f31155
Call-ID: 64a07883-cf3a-ee11-94af-da5682f31155-79@gb-128-38
To: <sip:<PHONE_NUMBER_REDACTED>@<IP_REDACTED>>
Contact: <sip:<IP_REDACTED>;did=18b.61593e63>
Allow: INVITE, ACK, OPTIONS, BYE, CANCEL, REGISTER, SUBSCRIBE, NOTIFY, REFER, MESSAGE, INFO, PING
Content-Type: application/sdp
Content-Length: 207
Max-Forwards: 69
Remote-Party-ID: <sip:gridborg@<IP_REDACTED>>
Min-SE: 7200

v=0
o=- <REDACTED><REDACTED> IN IP4 <IP_REDACTED>
s=Opal SIP Session
c=IN IP4 <IP_REDACTED>
t=0 0
m=audio 10318 RTP/AVP 0 101
a=rtpmap:0 PCMU/8000
a=rtpmap:101 telephone-event/8000
a=fmtp:101 0-15

2023-08-16 18:22:23.326513 99.37% [NOTICE] switch_channel.c:1142 New Channel sofia/external/~~~0~@<IP_REDACTED> [3cc392f0-3c6c-45d8-ad46-41101eb3a038]
2023-08-16 18:22:23.326513 99.37% [DEBUG] switch_core_state_machine.c:581 (sofia/external/~~~0~@<IP_REDACTED>) Running State Change CS_NEW (Cur 1 Tot 5)
2023-08-16 18:22:23.326513 99.37% [INFO] sofia.c:10459 sofia/external/~~~0~@<IP_REDACTED> receiving invite from <IP_REDACTED>:5060 version: 1.10.10 -release-24-4cb05e7f4a 64bit call-id: 64a07883-cf3a-ee11-94af-da5682f31155-79@gb-128-38
2023-08-16 18:22:23.326513 99.37% [DEBUG] sofia.c:7493 Channel sofia/external/~~~0~@<IP_REDACTED> entering state [received][100]
2023-08-16 18:22:23.326513 99.37% [DEBUG] sofia.c:7503 Remote SDP:
v=0
o=- <PHONE_NUMBER_REDACTED> <PHONE_NUMBER_REDACTED> IN IP4 <IP_REDACTED>
s=Opal SIP Session
c=IN IP4 <IP_REDACTED>
t=0 0
m=audio 10318 RTP/AVP 0 101
a=rtpmap:0 PCMU/8000
a=rtpmap:101 telephone-event/8000
a=fmtp:101 0-15

2023-08-16 18:22:23.326513 99.37% [DEBUG] sofia.c:7906 (sofia/external/~~~0~@<IP_REDACTED>) State Change CS_NEW -> CS_INIT
2023-08-16 18:22:23.326513 99.37% [DEBUG] switch_core_state_machine.c:600 (sofia/external/~~~0~@<IP_REDACTED>) State NEW
2023-08-16 18:22:23.326513 99.37% [DEBUG] switch_core_state_machine.c:581 (sofia/external/~~~0~@<IP_REDACTED>) Running State Change CS_INIT (Cur 1 Tot 5)
2023-08-16 18:22:23.326513 99.37% [DEBUG] switch_core_state_machine.c:624 (sofia/external/~~~0~@<IP_REDACTED>) State INIT
2023-08-16 18:22:23.326513 99.37% [DEBUG] mod_sofia.c:97 sofia/external/~~~0~@<IP_REDACTED> SOFIA INIT
2023-08-16 18:22:23.326513 99.37% [DEBUG] switch_core_state_machine.c:40 sofia/external/~~~0~@<IP_REDACTED> Standard INIT
2023-08-16 18:22:23.326513 99.37% [DEBUG] switch_core_state_machine.c:48 (sofia/external/~~~0~@<IP_REDACTED>) State Change CS_INIT -> CS_ROUTING
2023-08-16 18:22:23.326513 99.37% [DEBUG] switch_core_state_machine.c:624 (sofia/external/~~~0~@<IP_REDACTED>) State INIT going to sleep
2023-08-16 18:22:23.326513 99.37% [DEBUG] switch_core_state_machine.c:581 (sofia/external/~~~0~@<IP_REDACTED>) Running State Change CS_ROUTING (Cur 1 Tot 5)
2023-08-16 18:22:23.326513 99.37% [DEBUG] switch_channel.c:2399 (sofia/external/~~~0~@<IP_REDACTED>) Callstate Change DOWN -> RINGING
2023-08-16 18:22:23.326513 99.37% [DEBUG] switch_core_state_machine.c:640 (sofia/external/~~~0~@<IP_REDACTED>) State ROUTING
2023-08-16 18:22:23.326513 99.37% [DEBUG] mod_sofia.c:158 sofia/external/~~~0~@<IP_REDACTED> SOFIA ROUTING
2023-08-16 18:22:23.326513 99.37% [DEBUG] switch_core_state_machine.c:230 sofia/external/~~~0~@<IP_REDACTED> Standard ROUTING
2023-08-16 18:22:23.326513 99.37% [INFO] mod_dialplan_xml.c:639 Processing ~~~0~ <gridborg>-><PHONE_NUMBER_REDACTED> in context public
send 371 bytes to udp/[<IP_REDACTED>]:5060 at 18:22:23.345190:
------------------------------------------------------------------------
SIP/2.0 100 Trying
Via: SIP/2.0/UDP <IP_REDACTED>:5060;branch=z9hG4bK8bbb.4f76a707.0
From: <sip:%7E%7E%7E0%7E@<IP_REDACTED>>;tag=c6a27883-cf3a-ee11-94af-da5682f31155
To: <sip:<PHONE_NUMBER_REDACTED>@<IP_REDACTED>>
Call-ID: 64a07883-cf3a-ee11-94af-da5682f31155-79@gb-128-38
CSeq: 1 INVITE
User-Agent: FreeSWITCH-mod_sofia/1.10.10-release-24-4cb05e7f4a~64bit
Content-Length: 0


Dialplan: sofia/external/~~~0~@<IP_REDACTED> parsing [public->unloop] continue=false
Dialplan: sofia/external/~~~0~@<IP_REDACTED> Regex (PASS) [unloop] ${unroll_loops}(true) =~ /^true$/ break=on-false
Dialplan: sofia/external/~~~0~@<IP_REDACTED> Regex (FAIL) [unloop] ${sip_looped_call}() =~ /^true$/ break=on-false
Dialplan: sofia/external/~~~0~@<IP_REDACTED> parsing [public->outside_call] continue=true
Dialplan: sofia/external/~~~0~@<IP_REDACTED> Absolute Condition [outside_call]
Dialplan: sofia/external/~~~0~@<IP_REDACTED> Action set(outside_call=true)
Dialplan: sofia/external/~~~0~@<IP_REDACTED> Action export(RFC2822_DATE=${strftime(%a, %d %b %Y %T %z)})
Dialplan: sofia/external/~~~0~@<IP_REDACTED> parsing [public->call_debug] continue=true
Dialplan: sofia/external/~~~0~@<IP_REDACTED> Regex (FAIL) [call_debug] ${call_debug}(false) =~ /^true$/ break=never
Dialplan: sofia/external/~~~0~@<IP_REDACTED> parsing [public->public_extensions] continue=false
Dialplan: sofia/external/~~~0~@<IP_REDACTED> Regex (FAIL) [public_extensions] destination_number(<PHONE_NUMBER_REDACTED>) =~ /^(10[01][0-9])$/ break=on-false
Dialplan: sofia/external/~~~0~@<IP_REDACTED> parsing [public->public_conference_extensions] continue=false
Dialplan: sofia/external/~~~0~@<IP_REDACTED> Regex (FAIL) [public_conference_extensions] destination_number(<PHONE_NUMBER_REDACTED>) =~ /^(3[5-8][01][0-9])$/ break=on-false
Dialplan: sofia/external/~~~0~@<IP_REDACTED> parsing [public->public_did] continue=false
Dialplan: sofia/external/~~~0~@<IP_REDACTED> Regex (FAIL) [public_did] destination_number(<PHONE_NUMBER_REDACTED>) =~ /^(5551212)$/ break=on-false
Dialplan: sofia/external/~~~0~@<IP_REDACTED> parsing [public->capture_audio_with_python] continue=false
Dialplan: sofia/external/~~~0~@<IP_REDACTED> Regex (PASS) [capture_audio_with_python] destination_number(<PHONE_NUMBER_REDACTED>) =~ /<PHONE_NUMBER_REDACTED>/ break=on-false
Dialplan: sofia/external/~~~0~@<IP_REDACTED> Action answer()
Dialplan: sofia/external/~~~0~@<IP_REDACTED> Action playback(silence_stream://-1)
2023-08-16 18:22:23.326513 99.37% [DEBUG] switch_core_state_machine.c:281 (sofia/external/~~~0~@<IP_REDACTED>) State Change CS_ROUTING -> CS_EXECUTE
2023-08-16 18:22:23.326513 99.37% [DEBUG] switch_core_state_machine.c:640 (sofia/external/~~~0~@<IP_REDACTED>) State ROUTING going to sleep
2023-08-16 18:22:23.326513 99.37% [DEBUG] switch_core_state_machine.c:581 (sofia/external/~~~0~@<IP_REDACTED>) Running State Change CS_EXECUTE (Cur 1 Tot 5)
2023-08-16 18:22:23.326513 99.37% [DEBUG] switch_core_state_machine.c:647 (sofia/external/~~~0~@<IP_REDACTED>) State EXECUTE
2023-08-16 18:22:23.326513 99.37% [DEBUG] mod_sofia.c:213 sofia/external/~~~0~@<IP_REDACTED> SOFIA EXECUTE
2023-08-16 18:22:23.326513 99.37% [DEBUG] switch_core_state_machine.c:323 sofia/external/~~~0~@<IP_REDACTED> Standard EXECUTE
EXECUTE [depth=0] sofia/external/~~~0~@<IP_REDACTED> set(outside_call=true)
2023-08-16 18:22:23.326513 99.37% [DEBUG] mod_dptools.c:1671 SET sofia/external/~~~0~@<IP_REDACTED> [outside_call]=[true]
EXECUTE [depth=0] sofia/external/~~~0~@<IP_REDACTED> export(RFC2822_DATE=Wed, 16 Aug 2023 18:22:23 +0000)
2023-08-16 18:22:23.326513 99.37% [DEBUG] switch_channel.c:1334 EXPORT (export_vars) [RFC2822_DATE]=[Wed, 16 Aug 2023 18:22:23 +0000]
EXECUTE [depth=0] sofia/external/~~~0~@<IP_REDACTED> answer()
2023-08-16 18:22:23.326513 99.37% [DEBUG] switch_core_media.c:5526 Audio Codec Compare [PCMU:0:8000:20:64000:1]/[opus:116:48000:20:0:1]
2023-08-16 18:22:23.326513 99.37% [DEBUG] switch_core_media.c:5526 Audio Codec Compare [PCMU:0:8000:20:64000:1]/[G722:9:8000:20:64000:1]
2023-08-16 18:22:23.326513 99.37% [DEBUG] switch_core_media.c:5526 Audio Codec Compare [PCMU:0:8000:20:64000:1]/[PCMU:0:8000:20:64000:1]
2023-08-16 18:22:23.326513 99.37% [DEBUG] switch_core_media.c:5588 Audio Codec Compare [PCMU:0:8000:20:64000:1] ++++ is saved as a match
2023-08-16 18:22:23.326513 99.37% [DEBUG] switch_core_media.c:5526 Audio Codec Compare [PCMU:0:8000:20:64000:1]/[PCMA:8:8000:20:64000:1]
2023-08-16 18:22:23.326513 99.37% [DEBUG] switch_core_media.c:5438 Set telephone-event payload to 101@8000
2023-08-16 18:22:23.326513 99.37% [DEBUG] switch_core_media.c:3734 Set Codec sofia/external/~~~0~@<IP_REDACTED> PCMU/8000 20 ms 160 samples 64000 bits 1 channels
2023-08-16 18:22:23.326513 99.37% [DEBUG] switch_core_codec.c:111 sofia/external/~~~0~@<IP_REDACTED> Original read codec set to PCMU:0
2023-08-16 18:22:23.326513 99.37% [DEBUG] switch_core_media.c:5798 Set telephone-event payload to 101@8000
2023-08-16 18:22:23.326513 99.37% [DEBUG] switch_core_media.c:5856 sofia/external/~~~0~@<IP_REDACTED> Set 2833 dtmf send payload to 101 recv payload to 101
2023-08-16 18:22:23.326513 99.37% [DEBUG] switch_core_media.c:8659 AUDIO RTP [sofia/external/~~~0~@<IP_REDACTED>] <IP_REDACTED> port 17834 -> <IP_REDACTED> port 10318 codec: 0 ms: 20
2023-08-16 18:22:23.326513 99.37% [DEBUG] switch_rtp.c:4373 Starting timer [soft] 160 bytes per 20ms
2023-08-16 18:22:23.346459 99.37% [DEBUG] switch_core_media.c:8972 sofia/external/~~~0~@<IP_REDACTED> Set 2833 dtmf send payload to 101
2023-08-16 18:22:23.346459 99.37% [DEBUG] switch_core_media.c:8979 sofia/external/~~~0~@<IP_REDACTED> Set 2833 dtmf receive payload to 101
2023-08-16 18:22:23.346459 99.37% [DEBUG] switch_core_media.c:9002 sofia/external/~~~0~@<IP_REDACTED> Set rtp dtmf delay to 40
2023-08-16 18:22:23.346459 99.37% [NOTICE] sofia_media.c:90 Pre-Answer sofia/external/~~~0~@<IP_REDACTED>!
2023-08-16 18:22:23.346459 99.37% [DEBUG] switch_channel.c:3585 (sofia/external/~~~0~@<IP_REDACTED>) Callstate Change RINGING -> EARLY
2023-08-16 18:22:23.346459 99.37% [DEBUG] switch_core_media.c:8641 Audio params are unchanged for sofia/external/~~~0~@<IP_REDACTED>.
2023-08-16 18:22:23.346459 99.37% [DEBUG] mod_sofia.c:914 Local SDP sofia/external/~~~0~@<IP_REDACTED>:
v=0
o=FreeSWITCH <PHONE_NUMBER_REDACTED> <PHONE_NUMBER_REDACTED> IN IP4 <IP_REDACTED>
s=FreeSWITCH
c=IN IP4 <IP_REDACTED>
t=0 0
m=audio 17834 RTP/AVP 0 101
a=rtpmap:0 PCMU/8000
a=rtpmap:101 telephone-event/8000
a=fmtp:101 0-15
a=ptime:20
a=sendrecv

2023-08-16 18:22:23.346459 99.37% [NOTICE] mod_dptools.c:1406 Channel [sofia/external/~~~0~@<IP_REDACTED>] has been answered
send 1026 bytes to udp/[<IP_REDACTED>]:5060 at 18:22:23.347837:
------------------------------------------------------------------------
SIP/2.0 200 OK
Via: SIP/2.0/UDP <IP_REDACTED>:5060;branch=z9hG4bK8bbb.4f76a707.0
From: <sip:%7E%7E%7E0%7E@<IP_REDACTED>>;tag=c6a27883-cf3a-ee11-94af-da5682f31155
To: <sip:<PHONE_NUMBER_REDACTED>@<IP_REDACTED>>;tag=H3mZmB2S09X2a
Call-ID: 64a07883-cf3a-ee11-94af-da5682f31155-79@gb-128-38
CSeq: 1 INVITE
Contact: <sip:<PHONE_NUMBER_REDACTED>@<IP_REDACTED>:5060;transport=udp>
User-Agent: FreeSWITCH-mod_sofia/1.10.10-release-24-4cb05e7f4a~64bit
Accept: application/sdp
Allow: INVITE, ACK, BYE, CANCEL, OPTIONS, MESSAGE, INFO, UPDATE, REGISTER, REFER, NOTIFY
Supported: timer, path, replaces
Allow-Events: talk, hold, conference, refer
root@freeswitch:~# nc -nvlp 9999
listening on [any] 9999 ...
connect to [<IP_REDACTED>] from (UNKNOWN) [<IP_REDACTED>] 45240
root@freeswitch:~# python3 -m websockify <IP_REDACTED>:8888 <IP_REDACTED>:9999
WebSocket server settings:
  Listen on <IP_REDACTED>:8888
        0x0010:  0034 2915 4000 4006 13ad 7f00 0001 7f00  .4).@.@.........
        0x0020:  0001 b0b8 270f 1b4a cf79 4a86 610c 8010  ....'..J.yJ.a...
        0x0030:  01ff fe28 0000 0101 080a 7db1 530e 7db1  ...(......}.S.}.
        0x0010:  0034 2915 4000 4006 13ad 7f00 0001 7f00  .4).@.@.........
        0x0020:  0001 b0b8 270f 1b4a cf79 4a86 610c 8010  ....'..J.yJ.a...
        0x0030:  01ff fe28 0000 0101 080a 7db1 530e 7db1  ...(......}.S.}.
v=0
o=FreeSWITCH <PHONE_NUMBER_REDACTED> <PHONE_NUMBER_REDACTED> IN IP4 <IP_REDACTED>
s=FreeSWITCH
c=IN IP4 <IP_REDACTED>
t=0 0
m=audio 17834 RTP/AVP 0 101
a=rtpmap:0 PCMU/8000
a=rtpmap:101 telephone-event/8000
a=fmtp:101 0-15
a=ptime:20

2023-08-16 18:22:23.346459 99.37% [DEBUG] switch_channel.c:3912 (sofia/external/~~~0~@<IP_REDACTED>) Callstate Change EARLY -> ACTIVE
2023-08-16 18:22:23.346459 99.37% [DEBUG] sofia.c:7493 Channel sofia/external/~~~0~@<IP_REDACTED> entering state [completed][200]
EXECUTE [depth=0] sofia/external/~~~0~@<IP_REDACTED> playback(silence_stream://-1)
2023-08-16 18:22:23.346459 99.37% [DEBUG] switch_ivr_play_say.c:1561 Codec Activated L16@8000hz 1 channels 20ms
recv 536 bytes from udp/[<IP_REDACTED>]:5060 at 18:22:23.349293:
------------------------------------------------------------------------
ACK sip:<PHONE_NUMBER_REDACTED>@<IP_REDACTED>:5060;transport=udp SIP/2.0
CSeq: 1 ACK
Via: SIP/2.0/UDP <IP_REDACTED>:5060;branch=z9hG4bK8bbb.4f76a707.2
P-Gb-Info: 1
From: <sip:%7E%7E%7E0%7E@<IP_REDACTED>>;tag=c6a27883-cf3a-ee11-94af-da5682f31155
Call-ID: 64a07883-cf3a-ee11-94af-da5682f31155-79@gb-128-38
To: <sip:<PHONE_NUMBER_REDACTED>@<IP_REDACTED>>;tag=H3mZmB2S09X2a
Contact: <sip:<IP_REDACTED>;did=18b.61593e63>
Allow: INVITE, ACK, OPTIONS, BYE, CANCEL, REGISTER, SUBSCRIBE, NOTIFY, REFER, MESSAGE, INFO, PING
Content-Length: 0
Max-Forwards: 69


2023-08-16 18:22:23.346459 99.37% [DEBUG] sofia.c:7493 Channel sofia/external/~~~0~@<IP_REDACTED> entering state [ready][200]
2023-08-16 18:22:24.066528 99.40% [DEBUG] switch_rtp.c:7503 Correct audio ip/port confirmed.
2023-08-16 18:22:24.366530 99.40% [WARNING] switch_core_media.c:3093 [CBR]: Asynchronous PTIME not supported, changing our end from 20 to 30
2023-08-16 18:22:24.386486 99.40% [DEBUG] switch_core_media.c:3635 Changing Codec from PCMU@20ms@8000hz to PCMU@30ms@8000hz
2023-08-16 18:22:24.406494 99.40% [DEBUG] switch_rtp.c:4248 RE-Starting timer [soft] 240 bytes per 30ms
2023-08-16 18:22:24.426466 99.40% [DEBUG] switch_core_media.c:3734 Set Codec sofia/external/~~~0~@<IP_REDACTED> PCMU/8000 30 ms 240 samples 64000 bits 1 channels
2023-08-16 18:22:24.426466 99.40% [DEBUG] switch_core_codec.c:124 sofia/external/~~~0~@<IP_REDACTED> Original read codec replaced with PCMU:0
2023-08-16 18:22:24.426466 99.40% [DEBUG] switch_core_media.c:16236 Engaging Write Buffer at 480 bytes to accommodate 320->480
freeswitch@freeswitch> show calls
uuid,direction,created,created_epoch,name,state,cid_name,cid_num,ip_addr,dest,presence_id,presence_data,accountcode,callstate,callee_name,callee_num,callee_direction,call_uuid,hostname,sent_callee_name,sent_callee_num,b_uuid,b_direction,b_created,b_created_epoch,b_name,b_state,b_cid_name,b_cid_num,b_ip_addr,b_dest,b_presence_id,b_presence_data,b_accountcode,b_callstate,b_callee_name,b_callee_num,b_callee_direction,b_sent_callee_name,b_sent_callee_num,call_created_epoch
3cc392f0-3c6c-45d8-ad46-41101eb3a038,inbound,2023-08-16 18:22:23,<PHONE_NUMBER_REDACTED>,sofia/external/~~~0~@<IP_REDACTED>,CS_EXECUTE,~~~0~,gridborg,<IP_REDACTED>,<PHONE_NUMBER_REDACTED>,,,,ACTIVE,,,,,freeswitch,,,,,,,,,,,,,,,,,,,,,,

1 total.

freeswitch@freeswitch> uuid_audio_stream 3cc392f0-3c6c-45d8-ad46-41101eb3a038 start ws://localhost:8888 mono 8k
+OK Success

2023-08-16 18:22:54.866487 99.23% [DEBUG] mod_audio_stream.c:144 mod_audio_stream cmd: 3cc392f0-3c6c-45d8-ad46-41101eb3a038 start ws://localhost:8888 mono 8k
2023-08-16 18:22:54.866487 99.23% [DEBUG] mod_audio_stream.c:75 calling stream_session_init.
2023-08-16 18:22:54.866487 99.23% [DEBUG] audio_streamer_glue.cpp:260 (3cc392f0-3c6c-45d8-ad46-41101eb3a038) no resampling needed for this call
2023-08-16 18:22:54.866487 99.23% [DEBUG] audio_streamer_glue.cpp:263 (3cc392f0-3c6c-45d8-ad46-41101eb3a038) stream_data_init
2023-08-16 18:22:54.866487 99.23% [DEBUG] mod_audio_stream.c:81 adding bug.
2023-08-16 18:22:54.866487 99.23% [DEBUG] switch_core_media_bug.c:976 Attaching BUG to sofia/external/~~~0~@<IP_REDACTED>
2023-08-16 18:22:54.866487 99.23% [DEBUG] mod_audio_stream.c:85 setting bug private data.
2023-08-16 18:22:54.866487 99.23% [DEBUG] mod_audio_stream.c:88 exiting start_capture.
2023-08-16 18:22:54.966481 99.23% [DEBUG] switch_core_io.c:448 Setting BUG Codec PCMU:0
2023-08-16 18:23:28.726504 99.37% [INFO] audio_streamer_glue.cpp:129 response: this message should show up in the freeswitch logs

2023-08-16 18:23:50.146480 99.27% [INFO] audio_streamer_glue.cpp:129 response: messages are sent, and they show up on both ends of the tcpdump, and do show in the freeswitch logs

2023-08-16 18:24:23.226482 99.30% [INFO] audio_streamer_glue.cpp:129 response: which means they are making it from the socket to the websocket and back, but at no point does any audio data begin to send, which seems odd to me

2023-08-16 18:24:58.086481 99.27% [INFO] audio_streamer_glue.cpp:129 response: i would expect netcat to print a bunch of gargage to the console as audio data is sent from the call to the websocket and then to netcat
```

**Comment by amigniter** [comment]
Can I please see your dialplan? I suspect there is something causing the issue.. Regarding the module, it is really working properly, as expected. Is your FS installed from a repository, or is it custom built?
Can you please do a simple dialplan test, place a call and answer it and then you can do a websocket streaming from fs_cli? Or originate a call to a softphone client, park it and then stream it.
I will try to recreate your scenario with your dialplan so we can see where the problem is.

**Comment by placs-tdettling** [comment]
Yeah here is the dialplan:
```XML
<extension name="play_silence">
    <condition field="destination_number" expression="8170005555">
        <action application="answer"/>
        <action application="playback" data="silence_stream://-1"/>
    </condition>
</extension>
```

I then try to go in the cli once the silence is playing to start a stream, which seems to be successful and then messages are passed over websocket as expected when the client sends one but I do not see the audio coming in. 

I am sure there is just something that is weird about our setup but I am not sure what I can identify here. This is a completely fresh freeswitch install from the debian package (tried sources too) and then built your module and some required conf changes for IPs and stuff but thats about it as far as changes that I have made.

**Comment by amigniter** [comment]
I see. **silence_stream** here is doing an indefinite playback of silence. It is taking precedence over the audio stream intended for the WebSocket. Can you comment out the _playback_ line and make a test call using a softphone client, then test the API method, say something etc. You should have audio packets sent to websocket endpoint.

**Comment by t-dettling** [comment]
Sorry I was gone from where I was working on this for a few weeks while I had some other stuff to take care of. 

I did comment out the line today and I was able to get audio packets coming in the web socket so this is the issue. I did not realize that it captured the audio like that but in retrospect that makes sense.

Thank you!

**Comment by amigniter** [comment]
You're welcome! Yes, the audio packets are captured like that. What it is actually doing is a media bug is attached to a channel, capturing the audio, and all of the audio frames are accessed through the media bug. That is how it works under the hood. Have fun using the module!
